{
  "confidence": 0.95,
  "did_verdict_change": "no",
  "direction_of_change": "none",
  "escalation_decision": "escalate",
  "final_rationale": "No genuinely new admissible evidence was provided. The Actor materially narrowed the claim and correctly conceded that clean certification is unsupported, but that reframing does not cure the underlying evidence gap. Under the policy text, certification without material caveats requires either current evidence that no material weakness remains or an approved mitigation with owner, threshold, review date, and rollback criterion. The current record has neither. A caveated position could become supportable if the final certification artifacts expressly disclosed the unresolved pharmacy limitation or if approved risk acceptance/mitigation were produced, but that is not yet in evidence. The distinction matters: a caveated argument is not the same as a satisfied compliance predicate. Because the current record still lacks the required approved mitigation or final aligned disclosure artifact, the audit picture remains suspicious rather than compliant_with_caveats.",
  "final_risk_score": 0.79,
  "final_verdict": "suspicious",
  "new_admissible_evidence_received": "no",
  "new_evidence_quality": "none",
  "reason_for_change": "none",
  "remaining_concerns": [
    "The pharmacy prior authorization slice remains below target in a named launch use case, so a material weakness remains on the admissible record.",
    "The mitigation artifact is still only a draft and lacks required approval/governance fields, including owner and alert threshold; no approved mitigation with the policy-required elements is in evidence.",
    "The model-card draft appears inconsistent with the disclosure requirement because it says there are no known material limitations while the unresolved pharmacy limitation remains under reviewer challenge.",
    "No admissible evidence shows approved risk acceptance or a final disclosure artifact that expressly documents the limitation before certification.",
    "The Actor's narrowed position is a reinterpretation of the same record, not new evidence satisfying the policy predicate for certification."
  ]
}
