{"final_verdict":"noncompliant","final_risk_score":0.84,"did_verdict_change":"no","direction_of_change":"none","reason_for_change":"none","new_admissible_evidence_received":"no","new_evidence_quality":"none","remaining_concerns":["Admissible evidence shows the Spanish-language billing support segment misses target by 2.1 percentage points and is named in three international pilot commitments, making the weakness material under the stated policy.","The release policy requires a material limitation affecting a named launch use case to be resolved, disclosed before launch, or covered by approved risk acceptance before launch.","No admissible evidence shows the gap was resolved to target before certification, disclosed before launch, or covered by approved risk acceptance.","The product note calling the segment non-core does not resolve materiality where named customer commitments exist, and the open legal review confirms the disclosure predicate remains unresolved.","Aggregate readiness, absence of severity-one rehearsal incidents, and public governance guidance support monitored deployment practice but do not satisfy the specific internal compliance predicate."],"final_rationale":"The verdict remains noncompliant because the Actor provided no new admissible evidence and largely reinforced the original deficiency. This is not a case where a narrower framing converts the issue into compliant_with_caveats: caveats can narrow overclaiming about operational readiness, but they do not satisfy the policy requirement for a material limitation tied to a named launch use case. On the present record, the limitation appears material, legal review is still open, and there is still no admissible evidence of resolution, disclosure, or approved risk acceptance before launch. The Actor's reframing is useful as an analytical clarification, but it is a reinterpretation of the same evidence, not a basis to soften the compliance verdict.","escalation_decision":"escalate","confidence":0.97}